<?xml version="1.0" encoding="UTF-8"?>
<dict xsi:noNamespaceSchemaLocation="../dict.xsd" xmlns:xsi="http://www.w3.org/2001/XMLSchema-instance"
      xmlns:xs="http://www.w3.org/2001/XMLSchema" xmlns:hfp="http://www.w3.org/2001/XMLSchema-hasFacetAndProperty"
      xmlns:fn="http://www.w3.org/2005/02/xpath-functions">
   <!-- This contains place names and toponyms that are 100% equivalent to their Russian counterparts. This list will be available for other languages written in the Cyrillic alphabet. -->
   <entry>
      <lemma>Татарстан</lemma>
      <stem/>
      <contlex>Prop-Plc-Rus</contlex>
      <pos>PROP</pos>
   </entry>
   <entry>
      <lemma>Казань</lemma>
      <stem/>
      <contlex>Prop-Plc-Rus</contlex>
      <pos>PROP</pos>
   </entry>
   <entry>
      <lemma>Азия</lemma>
      <stem/>
      <contlex>Prop-Plc-Rus</contlex>
      <pos>PROP</pos>
   </entry>
   <entry>
      <lemma>Австралия</lemma>
      <stem/>
      <contlex>Prop-Plc-Rus</contlex>
      <pos>PROP</pos>
   </entry>
   <entry>
      <lemma>Европа</lemma>
      <stem/>
      <contlex>Prop-Plc-Rus</contlex>
      <pos>PROP</pos>
   </entry>
   <entry>
      <lemma>Гольфстрим</lemma>
      <stem/>
      <contlex>Prop-Plc-Rus</contlex>
      <pos>PROP</pos>
   </entry>
   <entry>
      <lemma>Мордовия</lemma>
      <stem/>
      <contlex>Prop-Plc-Rus</contlex>
      <pos>PROP</pos>
   </entry>
   <entry>
      <lemma>Абхазия</lemma>
      <stem/>
      <contlex>Prop-Plc-Rus</contlex>
      <pos>PROP</pos>
   </entry>
   <entry>
      <lemma>Болгария</lemma>
      <stem/>
      <contlex>Prop-Plc-Rus</contlex>
      <pos>PROP</pos>
   </entry>
   <entry>
      <lemma>Ижевск</lemma>
      <stem>Ижевск2</stem>
      <contlex>Prop-Plc-Rus</contlex>
      <pos>PROP</pos>
   </entry>
   <entry>
      <lemma>Карелия</lemma>
      <stem/>
      <contlex>Prop-Plc-Rus</contlex>
      <pos>PROP</pos>
   </entry>
   <entry>
      <lemma>Краснодар</lemma>
      <stem/>
      <contlex>Prop-Plc-Rus</contlex>
      <pos>PROP</pos>
   </entry>
   <entry>
      <lemma>Москва</lemma>
      <stem/>
      <contlex>Prop-Plc-Rus</contlex>
      <pos>PROP</pos>
   </entry>
   <entry>
      <lemma>Петербург</lemma>
      <stem/>
      <contlex>Prop-Plc-Rus</contlex>
      <pos>PROP</pos>
   </entry>
   <entry>
      <lemma>Албания</lemma>
      <stem/>
      <contlex>Prop-Plc-Rus</contlex>
      <pos>PROP</pos>
   </entry>
   <entry>
      <lemma>Америка</lemma>
      <stem/>
      <contlex>Prop-Plc-Rus</contlex>
      <pos>PROP</pos>
   </entry>
   <entry>
      <lemma>Англия</lemma>
      <stem/>
      <contlex>Prop-Plc-Rus</contlex>
      <pos>PROP</pos>
   </entry>
   <entry>
      <lemma>Архангельск</lemma>
      <stem>Архангельск2</stem>
      <contlex>Prop-Plc-Rus</contlex>
      <pos>PROP</pos>
   </entry>
   <entry>
      <lemma>Атлантика</lemma>
      <stem/>
      <contlex>Prop-Plc-Rus</contlex>
      <pos>PROP</pos>
   </entry>
   <entry>
      <lemma>Балтия</lemma>
      <stem/>
      <contlex>Prop-Plc-Rus</contlex>
      <pos>PROP</pos>
   </entry>
   <entry>
      <lemma>Боливия</lemma>
      <stem/>
      <contlex>Prop-Plc-Rus</contlex>
      <pos>PROP</pos>
   </entry>
   <entry>
      <lemma>Бразилия</lemma>
      <stem/>
      <contlex>Prop-Plc-Rus</contlex>
      <pos>PROP</pos>
   </entry>
   <entry>
      <lemma>Чечня</lemma>
      <stem/>
      <contlex>Prop-Plc-Rus</contlex>
      <pos>PROP</pos>
   </entry>
   <entry>
      <lemma>Чернобыль</lemma>
      <stem/>
      <contlex>Prop-Plc-Rus</contlex>
      <pos>PROP</pos>
   </entry>
   <entry>
      <lemma>Чили</lemma>
      <stem/>
      <contlex>Prop-Plc-Rus</contlex>
      <pos>PROP</pos>
   </entry>
   <entry>
      <lemma>Дания</lemma>
      <stem/>
      <contlex>Prop-Plc-Rus</contlex>
      <pos>PROP</pos>
   </entry>
   <entry>
      <lemma>Эстония</lemma>
      <stem/>
      <contlex>Prop-Plc-Rus</contlex>
      <pos>PROP</pos>
   </entry>
   <entry>
      <lemma>Египет</lemma>
      <stem/>
      <contlex>Prop-Plc-Rus</contlex>
      <pos>PROP</pos>
   </entry>
   <entry>
      <lemma>Екатеринбург</lemma>
      <stem/>
      <contlex>Prop-Plc-Rus</contlex>
      <pos>PROP</pos>
   </entry>
   <entry>
      <lemma>Финляндия</lemma>
      <stem/>
      <contlex>Prop-Plc-Rus</contlex>
      <pos>PROP</pos>
   </entry>
   <entry>
      <lemma>Франция</lemma>
      <stem/>
      <contlex>Prop-Plc-Rus</contlex>
      <pos>PROP</pos>
   </entry>
   <entry>
      <lemma>Германия</lemma>
      <stem/>
      <contlex>Prop-Plc-Rus</contlex>
      <pos>PROP</pos>
   </entry>
   <entry>
      <lemma>Греция</lemma>
      <stem/>
      <contlex>Prop-Plc-Rus</contlex>
      <pos>PROP</pos>
   </entry>
   <entry>
      <lemma>Индия</lemma>
      <stem/>
      <contlex>Prop-Plc-Rus</contlex>
      <pos>PROP</pos>
   </entry>
   <entry>
      <lemma>Ингерманландия</lemma>
      <stem/>
      <contlex>Prop-Plc-Rus</contlex>
      <pos>PROP</pos>
   </entry>
   <entry>
      <lemma>Исландия</lemma>
      <stem/>
      <contlex>Prop-Plc-Rus</contlex>
      <pos>PROP</pos>
   </entry>
   <entry>
      <lemma>Италия</lemma>
      <stem/>
      <contlex>Prop-Plc-Rus</contlex>
      <pos>PROP</pos>
   </entry>
   <entry>
      <lemma>Израиль</lemma>
      <stem/>
      <contlex>Prop-Plc-Rus</contlex>
      <pos>PROP</pos>
   </entry>
   <entry>
      <lemma>Кипр</lemma>
      <stem/>
      <contlex>Prop-Plc-Rus</contlex>
      <pos>PROP</pos>
   </entry>
   <entry>
      <lemma>Киров</lemma>
      <stem/>
      <contlex>Prop-Plc-Rus</contlex>
      <pos>PROP</pos>
   </entry>
   <entry>
      <lemma>Китай</lemma>
      <stem/>
      <contlex>Prop-Plc-Rus</contlex>
      <pos>PROP</pos>
   </entry>
   <entry>
      <lemma>Княжпогост</lemma>
      <stem/>
      <contlex>Prop-Plc-Rus</contlex>
      <pos>PROP</pos>
   </entry>
   <entry>
      <lemma>Кореа</lemma>
      <stem/>
      <contlex>Prop-Plc-Rus</contlex>
      <pos>PROP</pos>
   </entry>
   <entry>
      <lemma>Котлас</lemma>
      <stem/>
      <contlex>Prop-Plc-Rus</contlex>
      <pos>PROP</pos>
   </entry>
   <entry>
      <lemma>Маньчжурия</lemma>
      <stem/>
      <contlex>Prop-Plc-Rus</contlex>
      <pos>PROP</pos>
   </entry>
   <entry>
      <lemma>Микунь</lemma>
      <stem/>
      <contlex>Prop-Plc-Rus</contlex>
      <pos>PROP</pos>
   </entry>
   <entry>
      <lemma>Молдавия</lemma>
      <stem/>
      <contlex>Prop-Plc-Rus</contlex>
      <pos>PROP</pos>
   </entry>
   <entry>
      <lemma>Норвегия</lemma>
      <stem/>
      <contlex>Prop-Plc-Rus</contlex>
      <pos>PROP</pos>
   </entry>
   <entry>
      <lemma>Новгород</lemma>
      <stem/>
      <contlex>Prop-Plc-Rus</contlex>
      <pos>PROP</pos>
   </entry>
   <entry>
      <lemma>Печора</lemma>
      <stem/>
      <contlex>Prop-Plc-Rus</contlex>
      <pos>PROP</pos>
   </entry>
   <entry>
      <lemma>Польша</lemma>
      <stem/>
      <contlex>Prop-Plc-Rus</contlex>
      <pos>PROP</pos>
   </entry>
   <entry>
      <lemma>Португалия</lemma>
      <stem/>
      <contlex>Prop-Plc-Rus</contlex>
      <pos>PROP</pos>
   </entry>
   <entry>
      <lemma>Прибалтика</lemma>
      <stem/>
      <contlex>Prop-Plc-Rus</contlex>
      <pos>PROP</pos>
   </entry>
   <entry>
      <lemma>Пруссия</lemma>
      <stem/>
      <contlex>Prop-Plc-Rus</contlex>
      <pos>PROP</pos>
   </entry>
   <entry>
      <lemma>Рим</lemma>
      <stem/>
      <contlex>Prop-Plc-Rus</contlex>
      <pos>PROP</pos>
   </entry>
   <entry>
      <lemma>Россия</lemma>
      <stem/>
      <contlex>Prop-Plc-Rus</contlex>
      <pos>PROP</pos>
   </entry>
   <entry>
      <lemma>Швеция</lemma>
      <stem/>
      <contlex>Prop-Plc-Rus</contlex>
      <pos>PROP</pos>
   </entry>
   <entry>
      <lemma>Салехард</lemma>
      <stem/>
      <contlex>Prop-Plc-Rus</contlex>
      <pos>PROP</pos>
   </entry>
   <entry>
      <lemma>Скандинавия</lemma>
      <stem/>
      <contlex>Prop-Plc-Rus</contlex>
      <pos>PROP</pos>
   </entry>
   <entry>
      <lemma>Сомали</lemma>
      <stem/>
      <contlex>Prop-Plc-Rus</contlex>
      <pos>PROP</pos>
   </entry>
   <entry>
      <lemma>Сосногорск</lemma>
      <stem>Сосногорск2</stem>
      <contlex>Prop-Plc-Rus</contlex>
      <pos>PROP</pos>
   </entry>
   <entry>
      <lemma>США</lemma>
      <stem/>
      <contlex>ACRON</contlex>
      <pos>PROP</pos>
   </entry>
   <entry>
      <lemma>СНГ</lemma>
      <stem/>
      <contlex>ACRON</contlex>
      <pos>PROP</pos>
   </entry>
   <entry>
      <lemma>Сибир</lemma>
      <stem/>
      <contlex>Prop-Plc-Rus</contlex>
      <pos>PROP</pos>
   </entry>
   <entry>
      <lemma>Стокгольм</lemma>
      <stem/>
      <contlex>Prop-Plc-Rus</contlex>
      <pos>PROP</pos>
   </entry>
   <entry>
      <lemma>Тюмень</lemma>
      <stem/>
      <contlex>Prop-Plc-Rus</contlex>
      <pos>PROP</pos>
   </entry>
   <entry>
      <lemma>Турция</lemma>
      <stem/>
      <contlex>Prop-Plc-Rus</contlex>
      <pos>PROP</pos>
   </entry>
   <entry>
      <lemma>Югославия</lemma>
      <stem/>
      <contlex>Prop-Plc-Rus</contlex>
      <pos>PROP</pos>
   </entry>
   <entry>
      <lemma>Удмуртия</lemma>
      <stem/>
      <contlex>Prop-Plc-Rus</contlex>
      <pos>PROP</pos>
   </entry>
   <entry>
      <lemma>Волга</lemma>
      <stem/>
      <contlex>Prop-Plc-Rus</contlex>
      <pos>PROP</pos>
   </entry>
   <entry>
      <lemma>Вологда</lemma>
      <stem/>
      <contlex>Prop-Plc-Rus</contlex>
      <pos>PROP</pos>
   </entry>
   <entry>
      <lemma>Воркута</lemma>
      <stem/>
      <contlex>Prop-Plc-Rus</contlex>
      <pos>PROP</pos>
   </entry>
</dict>
