<?xml version="1.0" encoding="UTF-8"?>
<dict xsi:noNamespaceSchemaLocation="../dict.xsd" xmlns:xsi="http://www.w3.org/2001/XMLSchema-instance"
      xmlns:xs="http://www.w3.org/2001/XMLSchema">
   <entry>
      <lemma>АК</lemma>
      <stem/>
      <contlex>Noun1-IS_ACRON</contlex>
      <pos>N</pos>
   </entry>
   <entry>
      <lemma>АО</lemma>
      <stem/>
      <contlex>Noun1-IS_ACRON</contlex>
      <pos>N</pos>
   </entry>
   <entry>
      <lemma>АОЗТ</lemma>
      <stem/>
      <contlex>Noun1-IS_ACRON</contlex>
      <pos>N</pos>
   </entry>
   <entry>
      <lemma>АПК</lemma>
      <stem/>
      <contlex>Noun1-IS_ACRON</contlex>
      <pos>N</pos>
   </entry>
   <entry>
      <lemma>АССР</lemma>
      <stem/>
      <contlex>Noun1-IS_ACRON</contlex>
      <pos>N</pos>
   </entry>
   <entry>
      <lemma>АТП</lemma>
      <stem/>
      <contlex>Noun1-IS_ACRON</contlex>
      <pos>N</pos>
   </entry>
   <entry>
      <lemma>АЭК</lemma>
      <stem/>
      <contlex>Noun1-IS_ACRON</contlex>
      <pos>N</pos>
   </entry>
   <entry>
      <lemma>ВИЧ</lemma>
      <stem/>
      <contlex>Noun1-IS_ACRON</contlex>
      <pos>N</pos>
   </entry>
   <entry>
      <lemma>ГАП</lemma>
      <stem/>
      <contlex>Noun1-IS_ACRON</contlex>
      <pos>N</pos>
   </entry>
   <entry>
      <lemma>ДВП</lemma>
      <stem/>
      <contlex>Noun1-IS_ACRON</contlex>
      <pos>N</pos>
   </entry>
   <entry>
      <lemma>ДРСУ</lemma>
      <stem/>
      <contlex>Noun1-IS_ACRON</contlex>
      <pos>N</pos>
   </entry>
   <entry>
      <lemma>ДСП</lemma>
      <stem/>
      <contlex>Noun1-IS_ACRON</contlex>
      <pos>N</pos>
   </entry>
   <entry>
      <lemma>ЖЭК</lemma>
      <stem/>
      <contlex>Noun1-IS_ACRON</contlex>
      <pos>N</pos>
   </entry>
   <entry>
      <lemma>КР</lemma>
      <stem/>
      <contlex>Noun1-IS_ACRON</contlex>
      <pos>N</pos>
   </entry>
   <entry>
      <lemma>ЛПК</lemma>
      <stem/>
      <contlex>Noun1-IS_ACRON</contlex>
      <pos>N</pos>
   </entry>
   <entry>
      <lemma>НГП</lemma>
      <stem/>
      <contlex>Noun1-IS_ACRON</contlex>
      <pos>N</pos>
   </entry>
   <entry>
      <lemma>НКГБ</lemma>
      <stem/>
      <contlex>Noun1-IS_ACRON</contlex>
      <pos>N</pos>
   </entry>
   <entry>
      <lemma>НПГ</lemma>
      <stem/>
      <contlex>Noun1-IS_ACRON</contlex>
      <pos>N</pos>
   </entry>
   <entry>
      <lemma>НПЗ</lemma>
      <stem/>
      <contlex>Noun1-IS_ACRON</contlex>
      <pos>N</pos>
   </entry>
   <entry>
      <lemma>НПСР</lemma>
      <stem/>
      <contlex>Noun1-IS_ACRON</contlex>
      <pos>N</pos>
   </entry>
   <entry>
      <lemma>ПМК</lemma>
      <stem/>
      <contlex>Noun1-IS_ACRON</contlex>
      <pos>N</pos>
   </entry>
   <entry>
      <lemma>ПФ</lemma>
      <stem/>
      <contlex>Noun1-IS_ACRON</contlex>
      <pos>N</pos>
   </entry>
   <entry>
      <lemma>РСКБ</lemma>
      <stem/>
      <contlex>Noun1-IS_ACRON</contlex>
      <pos>N</pos>
   </entry>
   <entry>
      <lemma>РСФСР</lemma>
      <stem/>
      <contlex>Noun1-IS_ACRON</contlex>
      <pos>N</pos>
   </entry>
   <entry>
      <lemma>РФ</lemma>
      <stem/>
      <contlex>Noun1-IS_ACRON</contlex>
      <pos>N</pos>
   </entry>
   <entry>
      <lemma>РФЖК</lemma>
      <stem/>
      <contlex>Noun1-IS_ACRON</contlex>
      <pos>N</pos>
   </entry>
   <entry>
      <lemma>РЭУ</lemma>
      <stem/>
      <contlex>Noun1-IS_ACRON</contlex>
      <pos>N</pos>
   </entry>
   <entry>
      <lemma>САУ</lemma>
      <stem/>
      <contlex>Noun1-IS_ACRON</contlex>
      <pos>N</pos>
   </entry>
   <entry>
      <lemma>СП</lemma>
      <stem/>
      <contlex>Noun1-IS_ACRON</contlex>
      <pos>N</pos>
   </entry>
   <entry>
      <lemma>СПИД</lemma>
      <stem/>
      <contlex>Noun1-IS_ACRON</contlex>
      <pos>N</pos>
   </entry>
   <entry>
      <lemma>СССР</lemma>
      <stem/>
      <contlex>Noun1-IS_ACRON</contlex>
      <pos>N</pos>
   </entry>
   <entry>
      <lemma>ТОО</lemma>
      <stem/>
      <contlex>Noun1-IS_ACRON</contlex>
      <pos>N</pos>
   </entry>
   <entry>
      <lemma>УВД</lemma>
      <stem/>
      <contlex>Noun1-IS_ACRON</contlex>
      <pos>N</pos>
   </entry>
   <entry>
      <lemma>УНПО</lemma>
      <stem/>
      <contlex>Noun1-IS_ACRON</contlex>
      <pos>N</pos>
   </entry>
   <entry>
      <lemma>ЦБ</lemma>
      <stem/>
      <contlex>Noun1-IS_ACRON</contlex>
      <pos>N</pos>
   </entry>
</dict>
